{
  "$schema": "./source-registry.v1.schema.json",
  "registryVersion": "1.0.0",
  "reviewedAt": "2026-09-09",
  "intendedUse": "Handleplan public price comparison, basket planning, offer discovery, branch lookup, and opt-in route estimates",
  "states": {
    "approved": "The intended use is supported by recorded primary evidence and all known obligations are accepted.",
    "conditional": "The source is a viable candidate, but at least one permission, contract, privacy, retention, attribution, quota, or operational condition remains unresolved. It must not feed public ranking.",
    "blocked": "The intended automated use is not authorized or has no affirmative permission evidence. Fetching and serving are disabled.",
    "revoked": "Previously considered access has been withdrawn, suspended, terminated, or invalidated. Fetching and serving are disabled immediately."
  },
  "policy": {
    "defaultState": "blocked",
    "defaultRuntimeEnabled": false,
    "publicRankingRequires": "approved",
    "unknownPermissionBehavior": "blocked",
    "stateChangeRequires": [
      "dated primary evidence",
      "named reviewer",
      "recorded obligations",
      "coverage manifest regeneration"
    ]
  },
  "sources": [
    {
      "id": "kassalapp",
      "owner": "Kassalapp",
      "runtimeState": "conditional",
      "runtimeDefaultEnabled": false,
      "publicRankingEligible": false,
      "intendedUse": "Product catalog, ordinary package-price observations, price history, and physical-store directory",
      "dataClasses": [
        "product_catalog",
        "ordinary_price_observation",
        "price_history",
        "physical_store"
      ],
      "rights": {
        "access": "conditional",
        "processing": "unknown",
        "retention": "unknown",
        "derivedDisplay": "unknown",
        "redistribution": "unknown",
        "imagery": "unknown",
        "marks": "unknown",
        "attribution": "unknown"
      },
      "rateLimit": "Credential tier is unknown. The current public pricing page lists 60 requests/minute for Hobby and no rate limit for Bedrift; current-key terms have not been verified.",
      "terminationRisk": "Access and downstream retention rights after termination are unknown.",
      "killSwitchKey": "source.kassalapp.enabled",
      "requiredActions": [
        "Resolve https://github.com/Reedtrullz/Handli/issues/5 and record the current credential tier and governing agreement without copying the credential value.",
        "Obtain or record permission for persistent storage, derived rankings, public display, and any redistribution.",
        "Clarify product imagery, retailer marks, attribution, rate limits, termination, and deletion obligations.",
        "Run a representative endpoint and coverage probe only after the agreement permits it."
      ],
      "knownUnknowns": [
        "Whether the current credential is Hobby, Bedrift, premium, or governed by custom terms",
        "Whether a public AGPL service with no ads, affiliate links, paywall, data sale, or other monetization qualifies for Hobby use",
        "Whether ordinary-price observations may be retained append-only",
        "Whether public basket rankings and historical aggregates are allowed",
        "Whether image URLs or retailer marks may be displayed",
        "Required attribution and post-termination data handling",
        "Measured Bunnpris, REMA 1000, and Extra coverage in each candidate region"
      ],
      "evidence": [
        {
          "url": "https://kassal.app/pris",
          "kind": "official_commercial_page",
          "accessedAt": "2026-07-18",
          "finding": "The current page describes Hobby as access to all endpoints with a 60 requests/minute limit and no commercial use. It describes Bedrift as suitable for embedding price and product information in an app, priced at NOK 750/month, and requiring contact for an agreement."
        },
        {
          "url": "https://kassal.app/api",
          "kind": "official_api_documentation",
          "accessedAt": "2026-07-18",
          "finding": "The current official API page documents products, EAN lookup, bulk price history, and physical stores for Bunnpris, REMA 1000, and Coop Extra. Bulk history accepts at most 100 EANs and documents 90 days for regular users or 365 days for premium users."
        },
        {
          "url": "https://kassal.app/blogg/kassalapp-kommersiell-api-priser",
          "kind": "official_pricing_explanation",
          "accessedAt": "2026-07-18",
          "finding": "Kassalapp states that hobby projects remain free while commercial use requires payment, but it does not define Handleplan-specific storage, derived ranking, public display, imagery, attribution, or termination rights."
        }
      ],
      "revocationDisposition": "Stop fetch and serving; quarantine derived records; apply the governing agreement's deletion or retention requirements before reactivation."
    },
    {
      "id": "tjek",
      "owner": "Tjek",
      "runtimeState": "conditional",
      "runtimeDefaultEnabled": false,
      "publicRankingEligible": false,
      "intendedUse": "Structured publications and official offers for authorized chains and regions",
      "dataClasses": [
        "publication",
        "official_offer",
        "offer_imagery",
        "offer_scope"
      ],
      "rights": {
        "access": "conditional",
        "processing": "conditional",
        "retention": "unknown",
        "derivedDisplay": "conditional",
        "redistribution": "prohibited",
        "imagery": "unknown",
        "marks": "unknown",
        "attribution": "unknown"
      },
      "rateLimit": "The public terms state a default fair-use ceiling of 8,000,000 API calls per month per country unless agreed otherwise; the project has no verified agreement.",
      "terminationRisk": "Access may be suspended for misuse or excess use, and the agreement controls the licensed period and services.",
      "killSwitchKey": "source.tjek.enabled",
      "requiredActions": [
        "Obtain a Tjek quote/agreement that names Handleplan's public website and intended derived displays.",
        "Record authorized chains, countries, regions, fields, imagery, attribution, storage, cache, and termination rules.",
        "Confirm whether offer extraction or any automated classification is permitted; no Tjek content may train or improve an AI model without explicit written approval.",
        "Record retailer-rights consents where the agreement requires them."
      ],
      "knownUnknowns": [
        "Whether Handleplan will become a Tjek customer",
        "Which Norwegian retailer publications and offer fields would be licensed",
        "Whether normalized prices, savings calculations, and cross-store rankings may be retained and displayed",
        "Whether publication images, product images, and retailer marks may be displayed",
        "Attribution wording, cache duration, deletion, and post-termination handling",
        "Latest runtime approval is not a Handleplan-specific agreement and has no private or public contract reference."
      ],
      "evidence": [
        {
          "url": "https://tjek.com/apis-and-sdks",
          "kind": "official_api_page",
          "accessedAt": "2026-07-16",
          "finding": "States that the API is available only to customers and directs prospective users to contact Tjek."
        },
        {
          "url": "https://tjek.com/terms",
          "kind": "official_terms",
          "accessedAt": "2026-07-16",
          "finding": "Sections 8.1-8.6 make API use agreement-specific, restrict use to agreed services on the customer's own platforms, restrict third-party reuse, and prohibit AI/ML training without written approval."
        }
      ],
      "revocationDisposition": "Disable fetch and public display immediately; invalidate active offers; retain or delete content only as the signed agreement permits."
    },
    {
      "id": "bunnpris-public-web",
      "owner": "Bunnpris",
      "runtimeState": "blocked",
      "runtimeDefaultEnabled": false,
      "publicRankingEligible": false,
      "intendedUse": "Automated extraction of Bunnpris stores, publications, and offers from public web pages",
      "dataClasses": [
        "physical_store",
        "publication",
        "official_offer",
        "offer_imagery"
      ],
      "rights": {
        "access": "unknown",
        "processing": "unknown",
        "retention": "unknown",
        "derivedDisplay": "unknown",
        "redistribution": "unknown",
        "imagery": "unknown",
        "marks": "unknown",
        "attribution": "unknown"
      },
      "rateLimit": "No authorized automated-feed limit is recorded.",
      "terminationRisk": "Public page availability may change without notice and does not establish a data license.",
      "killSwitchKey": "source.bunnpris-public-web.enabled",
      "requiredActions": [
        "Obtain written authorization or an authorized structured feed before automated ingestion.",
        "Record national, regional, and store-specific scope plus imagery, marks, attribution, retention, and revocation rules."
      ],
      "knownUnknowns": [
        "Automated access permission",
        "Offer-data reuse and derived-display rights",
        "Store-specific versus regional publication scope",
        "Image, trademark, attribution, retention, and termination rules"
      ],
      "evidence": [
        {
          "url": "https://www.bunnpris.no/",
          "kind": "official_public_page",
          "accessedAt": "2026-07-16",
          "finding": "Publishes customer-paper and store-finder links. This proves public presentation only, not permission for automated reuse."
        },
        {
          "url": "https://www.bunnpris.no/butikker",
          "kind": "official_store_directory",
          "accessedAt": "2026-07-16",